{
  "schemaVersion": "eip.run-request.v1",
  "id": "req_01HV7Y8M8F2KQ5W3P9R6T4N2AB",
  "correlationId": "corr_01HV7Y8M8F2KQ5W3P9R6T4N2AC",
  "idempotencyKey": "github-issue-4",
  "source": {
    "sourceId": "source_01HV7Y8M8F2KQ5W3P9R6T4N2AD",
    "sourceType": "github",
    "externalRef": "TommyKammy/Ensen-protocol"
  },
  "requestedBy": {
    "actorId": "actor_01HV7Y8M8F2KQ5W3P9R6T4N2AE",
    "actorType": "api_client",
    "displayName": "Ensen issue dispatcher"
  },
  "workItem": {
    "workItemId": "workitem_01HV7Y8M8F2KQ5W3P9R6T4N2AF",
    "externalId": "4",
    "title": "EIP-0001: Define RunRequest v1 schema",
    "url": "https://github.com/TommyKammy/Ensen-protocol/issues/4"
  },
  "mode": "plan",
  "createdAt": "2026-04-29T01:45:45Z",
  "target": {
    "targetType": "repository",
    "targetId": "repo_01HV7Y8M8F2KQ5W3P9R6T4N2AG",
    "externalRef": "TommyKammy/Ensen-protocol"
  },
  "policyContext": {
    "policySetId": "policy_01HV7Y8M8F2KQ5W3P9R6T4N2AH",
    "riskClasses": ["secrets"],
    "requiresApproval": true
  },
  "dataClassification": "public",
  "extensions": {
    "x-fixture-note": "synthetic GitHub issue request"
  }
}
